{
  "$schema": "https://json-schema.org/draft/2020-12/schema",
  "$id": "secb://schemas/mcp-upstream-registry/v1.0",
  "title": "SecB MCP Upstream Registry Schema",
  "description": "Declaration of upstream MCP servers SecB may front. Declares WHAT an upstream is and WHERE it must run, never how to spawn it: spawn-plan resolution is a pure downstream projection and activation remains a separate operator-authorized step.",
  "type": "object",
  "required": [
    "schema_version",
    "registry_id",
    "wsl_distro",
    "upstreams"
  ],
  "additionalProperties": false,
  "properties": {
    "schema_version": { "type": "string", "const": "1.0" },
    "registry_id": { "type": "string", "minLength": 1 },
    "description": { "type": "string" },
    "wsl_distro": {
      "type": "string",
      "minLength": 1,
      "description": "Distro name used to build the wsl.exe bridge when a wsl-runtime upstream is resolved from a Windows host."
    },
    "upstreams": {
      "type": "array",
      "items": { "$ref": "#/$defs/upstream" }
    }
  },
  "$defs": {
    "upstream": {
      "type": "object",
      "required": [
        "id",
        "description",
        "enabled",
        "transport",
        "runtime",
        "classification_ceiling"
      ],
      "additionalProperties": false,
      "properties": {
        "id": {
          "type": "string",
          "pattern": "^[a-z0-9][a-z0-9-]*$",
          "description": "Stable identifier. Also the namespace prefix once tools are fronted, so it must not collide across upstreams."
        },
        "description": { "type": "string", "minLength": 1 },
        "enabled": { "type": "boolean" },
        "transport": { "type": "string", "enum": ["stdio", "sse", "http"] },
        "runtime": {
          "type": "string",
          "enum": ["wsl", "windows", "any"],
          "description": "Where this upstream must actually execute or listen. 'any' means the command resolves on either host without a bridge."
        },
        "command": { "type": "string", "minLength": 1 },
        "args": { "type": "array", "items": { "type": "string" } },
        "env": {
          "type": "object",
          "additionalProperties": { "type": "string" }
        },
        "url": { "type": "string", "minLength": 1 },
        "classification_ceiling": {
          "type": "string",
          "enum": ["PUBLIC", "INTERNAL", "CONFIDENTIAL", "RESTRICTED"]
        },
        "timeout_ms": {
          "type": "integer",
          "minimum": 1000,
          "maximum": 600000,
          "description": "Per-request timeout for this upstream. Omitted means the proxy default."
        },
        "max_concurrency": {
          "type": "integer",
          "minimum": 1,
          "maximum": 64,
          "description": "Cap on in-flight calls to this upstream. Omitted means the proxy default, which follows the gateway-core house limit of 4."
        },
        "max_response_bytes": {
          "type": "integer",
          "minimum": 1024,
          "maximum": 8388608,
          "description": "Cap on one upstream response, measured after serialisation. An upstream reply is foreign text entering a model context, so an unbounded reply is a context-flooding surface, not just a memory concern."
        },
        "verified_status": {
          "type": "string",
          "enum": ["reachable", "unreachable", "unverified"],
          "description": "Last recorded observation. Advisory provenance only; it never grants or withholds reachability at resolve time."
        },
        "note": { "type": "string" }
      },
      "allOf": [
        {
          "if": { "properties": { "transport": { "const": "stdio" } }, "required": ["transport"] },
          "then": {
            "properties": { "command": { "type": "string", "minLength": 1 } },
            "required": ["command"]
          }
        },
        {
          "if": { "properties": { "transport": { "enum": ["sse", "http"] } }, "required": ["transport"] },
          "then": {
            "properties": { "url": { "type": "string", "minLength": 1 } },
            "required": ["url"]
          }
        }
      ]
    }
  }
}
